{
  "$schema": "http://json-schema.org/draft-07/schema#",

  "definitions": {
    "ns": {
      "type": "object",
      "description": "A Network Service",
      "properties":{
        "nfvo-id":{
          "type": "string",
          "description": "The NFVO that will manage the life cycle of the NS"
        },
        "nsd-id": {
          "type": "string",
          "description": "The NSD id as defined on the NFVO"
        },
        "ns-name": {
          "type": "string",
          "description": "The name of the NS"
        },
        "placement": {
          "type": "number",
          "enum": [0, 1],
          "description": "1: Core, 2: Edge"
        },
        "ems-id": {
          "type": "string",
          "description": "Optional - Defines the EMS that is responsible for D1&2 configuration"
        },
        "optional":{
          "type": "boolean"
        }
      }
    },
    "pnf": {
      "type": "object",
      "description": "A Physical Network Service",
      "properties": {
        "ns-name": {
          "type": "string",
          "description": "The name of the PNF"
        },
        "ems-id": {
          "type": "string",
          "description": "Optional - Defines the EMS that is responsible for D1&2 configuration"
        },
        "pdu-id": {
          "type": "string",
          "description": "The Physical Device Unit that will be used for the PNF"
        },
        "optional":{
          "type": "boolean"
        }
      }
    }
  },

  "type": "object",
  "description": "A supported slice by the platform",
  "properties": {
    "sst": {
      "type": "number",
      "enum": [1, 2, 3],
      "description": "1: embb, 2: urllc, 3: iot"
    },
    "sd": {
      "type": "number",
      "description": "Service Differentiator - Optional information that complements the Slice/Service type(s) to differentiate amongst multiple Network Slices of the same SST"
    },
    "name": {
      "type": "string",
      "description": "Optional name for the SST"
    },
    "supported_locations": {
      "type": "array",
      "description" : "A list of the supported edge locations of the platform for that slice",
      "items": {
        "type": "string",
        "description": "A location"
      }
    },
    "ns_list": {
      "type": "array",
      "description": "A list of the NSs that will be part of the slice",
      "items": {
        "$ref": "#/definitions/ns"
      }
    },
    "pnf_list": {
      "type": "array",
      "description": "A list of the PNFs that will be part of the slice",
      "items": {
        "$ref": "#/definitions/pnf"
      }
    }
  }
}