{
    "sst": 1,
    "name": "5GCore",
    "supported_locations": [],
    "ns_list":[
        {
            "nfvo-id": "OSM6",
            "nsd-id": "2ca6ab45-e9d5-4397-932b-787886c4984e",
            "ns-name": "5GCore_GW_nsd",
            "placement": 0,
            "optional": false
        },
        {
            "nfvo-id": "OSM6",
            "nsd-id": "e47bb529-2c38-4b16-969a-fa9661f54824",
            "ns-name": "5GCore_MME-HSS_nsd",
            "placement": 0,
            "optional": false
        },
        {
            "nfvo-id": "OSM6",
            "nsd-id": "9add5eeb-0cdd-46b5-a551-eedb133e0432",
            "ns-name": "5GCore_PCRF_nsd",
            "placement": 0,
            "optional": true
        },
        {
            "nfvo-id": "OSM6",
            "nsd-id": "tbd",
            "ns-name": "dummy_ns",
            "placement": 0,
            "optional": true
        }
    ],
    "pnf_list":[]
}