{
    "sst": 1,
    "name": "dummy",
    "supported_locations": [],
    "ns_list":[
        {
            "nfvo-id": "OSM6",
            "nsd-id": "8aa747b5-26e5-4ed9-9f85-da153c92b2bf",
            "ns-name": "dummy_ns",
            "placement": 0,
            "optional": true
        }
    ],
    "pnf_list":[]
}